<?xml version="1.0" encoding="UTF-8"?>
<!-- 
<datasource xmlns="https://github.com/hongjinqiu/javameta/datasource" xmlns:xsi="http://www.w3.org/2001/XMLSchema-instance" xsi:schemaLocation="https://github.com/hongjinqiu/javameta/datasource https://raw.githubusercontent.com/hongjinqiu/javameta/master/src/main/java/schema/datasource.xsd">
 -->
<datasource xmlns="https://github.com/hongjinqiu/javameta/datasource" xmlns:xsi="http://www.w3.org/2001/XMLSchema-instance">
	<id>CashAccount</id>
	<displayName>现金账户</displayName>
	<inUsedDenyEdit>false</inUsedDenyEdit>
	<tableName>PUB_CASHACCOUNT</tableName>
	
	<masterData>
		<id>A</id>
		<displayName>主数据集</displayName>
		<allowCopy>true</allowCopy>
		<fixField>
			<primaryKey id="id" extends="PRIMARY_KEY" />
			<createBy id="createBy" extends="CREATE_BY" />
			<createTime id="createTime" extends="CREATE_TIME" />
			<createUnit id="createUnit" extends="CREATE_UNIT" />
			<modifyBy id="modifyBy" extends="MODIFY_BY" />
			<modifyUnit id="modifyUnit" extends="MODIFY_UNIT" />
			<modifyTime id="modifyTime" extends="MODIFY_TIME" />
			<remark id="remark" extends="REMARK" />
		</fixField>
		<bizField>
			<field id="" extends="code">
			</field>
			<field id="" extends="name">
			</field>
			<field id="" extends="mnemonicNo">
			</field>
			<field id="" extends="currencyTypeId">
			</field>
			<field id="" extends="dutyBy">
			</field>
			<field id="" extends="storeAddress">
			</field>
			<field id="" extends="amtSecureBalance">
			</field>
			<field id="" extends="amtOriginalCurrencyBalance">
			</field>
			<field id="" extends="amtLimits">
			</field>
			<field id="" extends="limitsControl">
			</field>
		</bizField>
	</masterData>
</datasource>
