<?xml version="1.0" encoding="UTF-8"?>
<!-- 
<datasource xmlns="https://github.com/hongjinqiu/javameta/datasource" xmlns:xsi="http://www.w3.org/2001/XMLSchema-instance" xsi:schemaLocation="https://github.com/hongjinqiu/javameta/datasource https://raw.githubusercontent.com/hongjinqiu/javameta/master/src/main/java/schema/datasource.xsd">
 -->
<datasource xmlns="https://github.com/hongjinqiu/javameta/datasource" xmlns:xsi="http://www.w3.org/2001/XMLSchema-instance">
	<id>ReferenceLog</id>
	<displayName>被用资料</displayName>
	<inUsedDenyEdit>false</inUsedDenyEdit>
	<tableName>PUB_REFERENCE_LOG</tableName>
	<masterData>
		<id>A</id>
		<displayName>主数据集</displayName>
		<allowCopy>true</allowCopy>
		<fixField>
			<primaryKey id="id" extends="PRIMARY_KEY" />
			<createBy id="createBy" extends="CREATE_BY" />
			<createTime id="createTime" extends="CREATE_TIME" />
			<createUnit id="createUnit" extends="CREATE_UNIT" />
			<modifyBy id="modifyBy" extends="MODIFY_BY" />
			<modifyUnit id="modifyUnit" extends="MODIFY_UNIT" />
			<modifyTime id="modifyTime" extends="MODIFY_TIME" />
			<remark id="remark" extends="REMARK" />
		</fixField>
		<bizField>
			<field id="" extends="ref_datasource_id">
				<displayName>关联方数据源ID</displayName>
			</field>
			<field id="" extends="ref_dataset_id">
				<displayName>关联方主数据集ID</displayName>
			</field>
			<field id="" extends="ref_field_id">
				<displayName>关联方主数据集主键ID</displayName>
			</field>
			<field id="" extends="ref_field_id_value">
				<displayName>关联方主数据集主键ID值</displayName>
			</field>
			<field id="ref_dataset_id_1" extends="ref_dataset_id">
				<displayName>关联方关联字段所在数据集ID</displayName>
			</field>
			<field id="ref_field_id_1" extends="ref_field_id">
				<displayName>关联方关联字段所在数据集主键ID</displayName>
			</field>
			<field id="ref_field_id_value_1" extends="ref_field_id_value">
				<displayName>关联方关联字段所在数据集主键ID值</displayName>
			</field>
			<field id="ref_dataset_id_2" extends="ref_dataset_id">
				<displayName>关联方关联字段所在数据集ID</displayName>
			</field>
			<field id="ref_field_id_2" extends="ref_field_id">
				<displayName>关联方关联字段ID</displayName>
			</field>
			<field id="ref_field_id_value_2" extends="ref_field_id_value">
				<displayName>关联方关联字段ID值</displayName>
			</field>
			
			<field id="" extends="be_ref_datasource_id">
				<displayName>被关联方数据源ID</displayName>
			</field>
			<field id="" extends="be_ref_dataset_id">
				<displayName>被关联方主数据集ID</displayName>
			</field>
			<field id="" extends="be_ref_field_id">
				<displayName>被关联方主数据集主键ID</displayName>
			</field>
			<field id="" extends="be_ref_field_id_value">
				<displayName>被关联方主数据集主键ID值</displayName>
			</field>
			<field id="be_ref_dataset_id_1" extends="be_ref_dataset_id">
				<displayName>被关联方关联字段所主数据集ID</displayName>
			</field>
			<field id="be_ref_field_id_1" extends="be_ref_field_id">
				<displayName>被关联方关联字段所在数据集主键ID</displayName>
			</field>
			<field id="be_ref_field_id_value_1" extends="be_ref_field_id_value">
				<displayName>被关联方关联字段所在主数据集主键ID值</displayName>
			</field>
		</bizField>
	</masterData>
</datasource>
